{
  "manifest_version": "1.0",
  "project": "BioGuard public research prototype",
  "program_mode": "hybrid",
  "attractors": [
    {
      "id": "conv-boundary",
      "frame": "The dangerous transaction is the conversation.",
      "why_high_impact": "Shifts control from downstream sequence checks to the real interception point where multi-turn bio misuse knowledge is assembled.",
      "proof_artifact": "spec/bkt_contract_v1.0.json + artifacts/metrics/results.json"
    },
    {
      "id": "protocol-first",
      "frame": "BioGuard is a portable conversation-layer protocol; BKT is the scoring contract.",
      "why_high_impact": "Replaces ad-hoc model tuning with a reusable interface that operators and integrators can adopt across hosts.",
      "proof_artifact": "spec/decision_envelope.schema.json + docs/README.md"
    },
    {
      "id": "operator-utility",
      "frame": "BioGuard returns auditable, action-ready decisions.",
      "why_high_impact": "Provides immediate operational value through decision + uncertainty + rationale, not just offline threat probabilities.",
      "proof_artifact": "artifacts/records/seed_screen.jsonl"
    },
    {
      "id": "research-continuation",
      "frame": "Prototype evidence should expose the next protocol revisions.",
      "why_high_impact": "Keeps the claim bounded while making failures useful for follow-up work.",
      "proof_artifact": "docs/BioGuard_Technical_Specification.md"
    },
    {
      "id": "operator-demo",
      "frame": "BioGuard gives operators an auditable checkpoint with replay, not just a score.",
      "why_high_impact": "Makes the project demoable, legible to judges, and directly useful for bio-LLM interface operators.",
      "proof_artifact": "artifacts/records/skill_bio_guard.json + artifacts/evidence/bundle_manifest.json"
    },
    {
      "id": "conformance-first",
      "frame": "Protocol portability is measured through conformance artifacts, not by host claims.",
      "why_high_impact": "Turns portability from a demo property into a reproducible, reviewable science object.",
      "proof_artifact": "artifacts/conformance/deviation_matrix.csv + artifacts/conformance/conformance_report.md"
    }
  ],
  "agent_roles": [
    {
      "id": "protocol-engine",
      "owner": "Workstream 1",
      "responsibilities": [
        "Lock contract artifacts and schemas.",
        "Maintain deterministic BKT scoring behavior.",
        "Own protocol change log updates."
      ],
      "inputs": [
        "spec/bkt_contract_v1.0.json",
        "spec/decision_envelope.schema.json",
        "spec/bioguard_api.openapi.yaml",
        "spec/execution_state_manifest_v1.0.json",
        "artifacts/conformance/host_capability_profile.schema.json",
        "artifacts/conformance/deviation_matrix.schema.json"
      ],
      "outputs": [
        "docs/protocol_release_notes.md",
        "artifacts/checks/protocol_lock.json",
        "spec/bkt_contract_v1.0.json (if changed)",
        "artifacts/conformance/host_capability_profile.schema.json",
        "artifacts/conformance/deviation_matrix.schema.json"
      ],
      "acceptance": [
        "All spec files are machine-parseable.",
        "Decision and schema fields match required payload.",
        "Escalation rules are deterministic and documented."
      ]
    },
    {
      "id": "core-implementation",
      "owner": "Workstream 2",
      "responsibilities": [
        "Implement /v1/screen flow.",
        "Implement BKT heuristics and decision envelope output.",
        "Generate deterministic fixture traces.",
        "Support operator replay and audit flow."
      ],
      "inputs": [
        "spec/execution_state_manifest_v1.0.json",
        "src/bioguard/core.py",
        "src/bioguard/cli.py",
        "src/bioguard/eval.py",
        "artifacts/data"
      ],
      "outputs": [
        "artifacts/records/seed_screen.jsonl",
        "artifacts/records/screen_bad_request.jsonl",
        "artifacts/records/skill_bio_guard.json",
        "src/bioguard/core.py",
        "src/bioguard/cli.py",
        "artifacts/conformance/host_capability_profile.json"
      ],
      "acceptance": [
        "500+ multi-turn fixtures are preferred when throughput permits; lower counts must be justified with tier balance.",
        "decision envelope schema fields are complete for 200/400/422 cases.",
        "Operator replay path is present and demoable."
      ]
    },
    {
      "id": "eval-engine",
      "owner": "Workstream 3",
      "responsibilities": [
        "Build baseline matrix for at least one keyword and one model baseline.",
        "Compute recall@5%FPR with confidence intervals.",
        "Emit compact result table and bootstrap summary.",
        "Produce tier breakdown and ablation comparison."
      ],
      "inputs": [
        "spec/benchmark_manifest_v1.0.json (train/dev/test splits)"
      ],
      "outputs": [
        "artifacts/metrics/hackathon_results.md",
        "artifacts/metrics/bootstrap.csv",
        "artifacts/metrics/confusion_matrix.csv",
        "artifacts/metrics/results.json"
      ],
      "acceptance": [
        "One primary comparison table with all baselines.",
        "One ablation comparison is present.",
        "CI and significance labels are populated."
      ]
    },
    {
      "id": "report-engine",
      "owner": "Workstream 4",
      "responsibilities": [
        "Write publication-grade report sections.",
        "Draft Limitations and Dual-Use appendix.",
        "Map artifacts to the reproducibility path.",
        "Prepare portability framing."
      ],
      "inputs": [
        "artifacts/metrics/*",
        "artifacts/records/seed_screen.jsonl",
        "spec/execution_state_manifest_v1.0.json"
      ],
      "outputs": [
        "artifacts/docs/report_draft.md",
        "bioguard_aixbio_submission.tex",
        "docs/PUBLICATION_RESEARCH_NOTES.md",
        "artifacts/conformance/conformance_report.md"
      ],
      "acceptance": [
        "Abstract and method sections are readable without repo-specific jargon.",
        "Dual-use appendix present with ethical and disclosure lines.",
        "Portability and operator-utility frames are explicit."
      ]
    }
  ],
  "milestones": [
    {
      "name": "Contract Lock",
      "day": 0,
      "goal": "Freeze scoring contract, output formats, and public evidence boundary.",
      "required_outputs": [
        "spec files validated",
        "agent role output folders created",
        "fixture seed manifest",
        "publication proof checklist"
      ]
    },
    {
      "name": "Core Runtime",
      "day": 1,
      "goal": "Reference runtime, skill pack, and operator replay flow runnable end-to-end.",
      "required_outputs": [
        "host-1 screen output JSONL",
        "initial API smoke artifacts",
        "preliminary methods draft",
        "operator demo path"
      ]
    },
    {
      "name": "Evidence",
      "day": 2,
      "goal": "Produce primary table, ablation table, and portability notes.",
      "required_outputs": [
        "metrics table",
        "top misses and false positives",
        "reproducibility command log",
        "host deviation notes"
      ]
    },
    {
      "name": "Public Submission",
      "day": 3,
      "goal": "Deliver polished workshop-style paper, public repo surface, and reproducibility path.",
      "required_outputs": [
        "report draft",
        "appendix completed",
        "plain-English docs",
        "public repo archive notes"
      ]
    }
  ],
  "success_metrics": {
    "fpr_level": 0.05,
    "primary_metric": "recall_at_5percent_fpr",
    "min_test_items": 100,
    "must_have_outputs": [
      "artifacts/records/seed_screen.jsonl",
      "artifacts/metrics/hackathon_results.md",
      "artifacts/metrics/bootstrap.csv",
      "artifacts/docs/Limitations_DualUse.md",
      "artifacts/records/skill_bio_guard.json",
      "bioguard_aixbio_submission.tex",
      "artifacts/conformance/deviation_matrix.csv",
      "artifacts/conformance/conformance_report.md"
    ],
    "secondary_metrics": [
      "latency_p95_ms",
      "bootstrap_ci_width",
      "interrater_alignment_proxy",
      "cross_host_smoke_status",
      "operator_replay_status",
      "host_deviation_matrix_status"
    ]
  }
}
